Bus Hound 7.04 capture. Complements of www.perisoft.net

  Device - Device ID (followed by the endpoint for USB devices)
            (14) Generic USB Hub
            (18) USB Composite Device
            (22) AIROHA Chat
            (23) AIROHA Media
            (24) USB Input Device
            (31) HID-compliant consumer control device
            (32) HID-compliant vendor-defined device
            (33) HID-compliant headset
            (68) Generic USB Hub
  Phase  - Phase Type
            CTL   USB control transfer       
            IN    Data in transfer           
            NTSTS NTSTATUS value             
            OUT   Data out transfer          
            USTS  USB status                 
  Data   - Hex dump of the data transferred
  Descr  - Description of the phase
  Cmd... - Position in the captured data


Device  Phase  Data                                                                                                    Description                       Cmd.Phase.Ofs(rep)
------  -----  ------------------------------------------------------------------------------------------------------  --------------------------------  ------------------
  68.1  IN     04                                                                                                      .                                        1.1.0(6)     
  18.0  CTL    80 06 0100 0000 0012                                                                                    GET DESCRIPTOR                           7.1.0        
  18.0  IN     12 01 00 02  00 00 00 40  8d 0e 0b 08  00 01 01 02  03 01                                               .......@..........                       7.2.0        
  18.0  CTL    80 06 0200 0000 0009                                                                                    GET DESCRIPTOR                           8.1.0        
  18.0  IN     09 02 a4 01  06 01 00 c0  32                                                                            ........2                                8.2.0        
  18.0  CTL    80 06 0200 0000 01a4                                                                                    GET DESCRIPTOR                           9.1.0        
  18.0  IN     09 02 a4 01  06 01 00 c0  32 09 04 00  00 00 01 01  00 04 0a 24  01 00 01 47  00 02 01 02  0c 24 02 01  ........2..........$...G.....$..         9.2.0        
  18.0  CTL    00 09 0001 0000 0000                                                                                    SET CONFIG                              10.1.0        
  18.0  CTL    c0 01 0000 0007 000a                                                                                    get ms vendor                           11.1.0        
  18.0  IN     00 00 00 00  00 00 00 00  00 00                                                                         ..........                              11.2.0        
  18.0  NTSTS  c00000bb                                                                                                not supported                           11.3.0        
  18.0  CTL    c0 01 0000 0004 0010                                                                                    get ms vendor                           12.1.0        
  18.0  IN     00 00 00 00  00 00 00 00  00 00 00 00  00 00 00 00                                                      ................                        12.2.0        
  18.0  NTSTS  c00000bb                                                                                                not supported                           12.3.0        
  18.0  CTL    80 06 0304 0409 0004                                                                                    GET DESCRIPTOR                          13.1.0        
  18.0  IN     18 03 41 00                                                                                             ..A.                                    13.2.0        
  18.0  CTL    80 06 0304 0409 0018                                                                                    GET DESCRIPTOR                          14.1.0        
  18.0  IN     18 03 41 00  49 00 52 00  4f 00 48 00  41 00 20 00  43 00 68 00  61 00 74 00                            ..A.I.R.O.H.A. .C.h.a.t.                14.2.0        
  18.0  CTL    80 06 0305 0409 0004                                                                                    GET DESCRIPTOR                          15.1.0        
  18.0  IN     1a 03 41 00                                                                                             ..A.                                    15.2.0        
  18.0  CTL    80 06 0305 0409 001a                                                                                    GET DESCRIPTOR                          16.1.0        
  18.0  IN     1a 03 41 00  49 00 52 00  4f 00 48 00  41 00 20 00  4d 00 65 00  64 00 69 00  61 00                     ..A.I.R.O.H.A. .M.e.d.i.a.              16.2.0        
  18.0  CTL    80 06 0306 0409 0004                                                                                    GET DESCRIPTOR                          17.1.0        
  18.0  IN     18 03 41 00                                                                                             ..A.                                    17.2.0        
  18.0  CTL    80 06 0306 0409 0018                                                                                    GET DESCRIPTOR                          18.1.0        
  18.0  IN     18 03 41 00  49 00 52 00  4f 00 48 00  41 00 20 00  43 00 68 00  61 00 74 00                            ..A.I.R.O.H.A. .C.h.a.t.                18.2.0        
  22.0  CTL    80 06 0100 0000 0012                                                                                    GET DESCRIPTOR                          19.1.0        
  22.0  IN     12 01 00 02  00 00 00 40  8d 0e 0b 08  00 01 01 04  03 01                                               .......@..........                      19.2.0        
  22.0  CTL    80 06 0200 0000 0009                                                                                    GET DESCRIPTOR                          20.1.0        
  22.0  IN     09 02 f5 00  03 01 00 c0  32                                                                            ........2                               20.2.0        
  22.0  CTL    80 06 0200 0000 00f5                                                                                    GET DESCRIPTOR                          21.1.0        
  22.0  IN     09 02 f5 00  03 01 00 c0  32 09 04 00  00 00 01 01  00 04 0a 24  01 00 01 47  00 02 01 02  0c 24 02 01  ........2..........$...G.....$..        21.2.0        
  22.0  CTL    00 09 0001 0000 0000                                                                                    SET CONFIG                              22.1.0        
  22.0  CTL    80 06 0304 0409 0004                                                                                    GET DESCRIPTOR                          23.1.0        
  22.0  IN     18 03 41 00                                                                                             ..A.                                    23.2.0        
  22.0  CTL    80 06 0304 0409 0018                                                                                    GET DESCRIPTOR                          24.1.0        
  22.0  IN     18 03 41 00  49 00 52 00  4f 00 48 00  41 00 20 00  43 00 68 00  61 00 74 00                            ..A.I.R.O.H.A. .C.h.a.t.                24.2.0        
  22.0  CTL    a1 81 0100 0200 0001                                                                                    CLASS REQ 81                            25.1.0        
  22.0  IN     00                                                                                                      .                                       25.2.0        
  22.0  CTL    a1 81 0201 0200 0002                                                                                    CLASS REQ 81                            26.1.0        
  22.0  IN     9a f5                                                                                                   ..                                      26.2.0        
  22.0  CTL    a1 82 0201 0200 0002                                                                                    CLASS REQ 82                            27.1.0        
  22.0  IN     00 b6                                                                                                   ..                                      27.2.0        
  22.0  CTL    a1 83 0201 0200 0002                                                                                    CLASS REQ 83                            28.1.0        
  22.0  IN     00 00                                                                                                   ..                                      28.2.0        
  22.0  CTL    a1 84 0201 0200 0002                                                                                    CLASS REQ 84                            29.1.0        
  22.0  IN     00 01                                                                                                   ..                                      29.2.0        
  22.0  CTL    a1 81 0202 0200 0002                                                                                    CLASS REQ 81                            30.1.0        
  22.0  IN     9a f5                                                                                                   ..                                      30.2.0        
  22.0  CTL    a1 82 0202 0200 0002                                                                                    CLASS REQ 82                            31.1.0        
  22.0  IN     00 b6                                                                                                   ..                                      31.2.0        
  22.0  CTL    a1 83 0202 0200 0002                                                                                    CLASS REQ 83                            32.1.0        
  22.0  IN     00 00                                                                                                   ..                                      32.2.0        
  22.0  CTL    a1 84 0202 0200 0002                                                                                    CLASS REQ 84                            33.1.0        
  22.0  IN     00 01                                                                                                   ..                                      33.2.0        
  22.0  CTL    a1 81 0100 0600 0001                                                                                    CLASS REQ 81                            34.1.0        
  22.0  IN     00                                                                                                      .                                       34.2.0        
  22.0  CTL    a1 81 0200 0600 0002                                                                                    CLASS REQ 81                            35.1.0        
  22.0  IN     9a f5                                                                                                   ..                                      35.2.0        
  22.0  CTL    a1 82 0200 0600 0002                                                                                    CLASS REQ 82                            36.1.0        
  22.0  IN     00 b6                                                                                                   ..                                      36.2.0        
  22.0  CTL    a1 83 0200 0600 0002                                                                                    CLASS REQ 83                            37.1.0        
  22.0  IN     00 00                                                                                                   ..                                      37.2.0        
  22.0  CTL    a1 84 0200 0600 0002                                                                                    CLASS REQ 84                            38.1.0        
  22.0  IN     00 01                                                                                                   ..                                      38.2.0        
  22.0  CTL    01 0b 0000 0001 0000                                                                                    SET INTERFACE                           39.1.0        
  22.0  CTL    01 0b 0000 0002 0000                                                                                    SET INTERFACE                           40.1.0        
  23.0  CTL    80 06 0100 0000 0012                                                                                    GET DESCRIPTOR                          41.1.0        
  23.0  IN     12 01 00 02  00 00 00 40  8d 0e 0b 08  00 01 01 05  03 01                                               .......@..........                      41.2.0        
  23.0  CTL    80 06 0200 0000 0009                                                                                    GET DESCRIPTOR                          42.1.0        
  23.0  IN     09 02 9f 00  02 01 00 c0  32                                                                            ........2                               42.2.0        
  23.0  CTL    80 06 0200 0000 009f                                                                                    GET DESCRIPTOR                          43.1.0        
  23.0  IN     09 02 9f 00  02 01 00 c0  32 09 04 03  00 00 01 01  00 05 09 24  01 00 01 28  00 01 04 0c  24 02 09 01  ........2..........$...(....$...        43.2.0        
  23.0  CTL    00 09 0001 0000 0000                                                                                    SET CONFIG                              44.1.0        
  23.0  CTL    80 06 0305 0409 0004                                                                                    GET DESCRIPTOR                          45.1.0        
  23.0  IN     1a 03 41 00                                                                                             ..A.                                    45.2.0        
  23.0  CTL    80 06 0305 0409 001a                                                                                    GET DESCRIPTOR                          46.1.0        
  23.0  IN     1a 03 41 00  49 00 52 00  4f 00 48 00  41 00 20 00  4d 00 65 00  64 00 69 00  61 00                     ..A.I.R.O.H.A. .M.e.d.i.a.              46.2.0        
  23.0  CTL    a1 81 0100 0a03 0001                                                                                    CLASS REQ 81                            47.1.0        
  23.0  IN     00                                                                                                      .                                       47.2.0        
  23.0  CTL    a1 81 0201 0a03 0002                                                                                    CLASS REQ 81                            48.1.0        
  23.0  IN     9a f5                                                                                                   ..                                      48.2.0        
  23.0  CTL    a1 82 0201 0a03 0002                                                                                    CLASS REQ 82                            49.1.0        
  23.0  IN     00 b6                                                                                                   ..                                      49.2.0        
  23.0  CTL    a1 83 0201 0a03 0002                                                                                    CLASS REQ 83                            50.1.0        
  23.0  IN     00 00                                                                                                   ..                                      50.2.0        
  23.0  CTL    a1 84 0201 0a03 0002                                                                                    CLASS REQ 84                            51.1.0        
  23.0  IN     00 01                                                                                                   ..                                      51.2.0        
  23.0  CTL    a1 81 0202 0a03 0002                                                                                    CLASS REQ 81                            52.1.0        
  23.0  IN     9a f5                                                                                                   ..                                      52.2.0        
  23.0  CTL    a1 82 0202 0a03 0002                                                                                    CLASS REQ 82                            53.1.0        
  23.0  IN     00 b6                                                                                                   ..                                      53.2.0        
  23.0  CTL    a1 83 0202 0a03 0002                                                                                    CLASS REQ 83                            54.1.0        
  23.0  IN     00 00                                                                                                   ..                                      54.2.0        
  23.0  CTL    a1 84 0202 0a03 0002                                                                                    CLASS REQ 84                            55.1.0        
  23.0  IN     00 01                                                                                                   ..                                      55.2.0        
  23.0  CTL    01 0b 0000 0004 0000                                                                                    SET INTERFACE                           56.1.0        
  24.0  CTL    80 06 0100 0000 0012                                                                                    GET DESCRIPTOR                          57.1.0        
  24.0  IN     12 01 00 02  00 00 00 40  8d 0e 0b 08  00 01 01 06  03 01                                               .......@..........                      57.2.0        
  24.0  CTL    80 06 0200 0000 0009                                                                                    GET DESCRIPTOR                          58.1.0        
  24.0  IN     09 02 22 00  01 01 00 c0  32                                                                            ..".....2                               58.2.0        
  24.0  CTL    80 06 0200 0000 0022                                                                                    GET DESCRIPTOR                          59.1.0        
  24.0  IN     09 02 22 00  01 01 00 c0  32 09 04 05  00 01 03 00  00 06 09 21  10 01 00 01  22 91 00 07  05 82 03 40  ..".....2..........!...."......@        59.2.0        
  24.0  CTL    00 09 0001 0000 0000                                                                                    SET CONFIG                              60.1.0        
  24.0  CTL    21 0a 0000 0005 0000                                                                                    set idle                                61.1.0        
  24.0  USTS   c0000004                                                                                                stall pid                               61.2.0        
  24.0  CTL    81 06 2200 0005 00d1                                                                                    GET DESCRIPTOR                          62.1.0        
  24.0  IN     05 0c 09 01  a1 01 85 0c  15 00 25 01  09 e9 09 ea  09 e2 09 cd  09 b5 09 b6  09 b0 09 b1  75 01 95 08  ..........%.................u...        62.2.0        
  24.0  CTL    21 09 0205 0005 0002                                                                                    set report                              63.1.0(3)     
  24.0  OUT    05 00                                                                                                   ..                                      63.2.0        
